{
  "$schema": "https://json-schema.org/draft/2020-12/schema",
  "type": "object",
  "properties": {
    "$schema": {
      "type": "string",
      "description": "Editor hint only; ignored by the loader."
    },
    "id": {
      "type": "string",
      "pattern": "^[a-z0-9]+(?:-[a-z0-9]+)*$",
      "description": "Unique merchant id, e.g. \"briar-glen-general-store\". Stable once shipped."
    },
    "notes": {
      "type": "string",
      "minLength": 1,
      "description": "Who runs it and why these prices and stock, for owner review."
    },
    "npcId": {
      "type": "string",
      "pattern": "^[a-z0-9]+(?:-[a-z0-9]+)*$",
      "description": "The NPC who speaks for the shop (dialogue speaker id)."
    },
    "displayName": {
      "description": "The keeper’s name as the shop window shows it, e.g. \"Ottilie Marsh\"; absent = the NPC id made readable.",
      "type": "string",
      "minLength": 1
    },
    "shopName": {
      "description": "The shop’s name, e.g. \"Brand’s Forge\" (signage, shop window subtitle).",
      "type": "string",
      "minLength": 1
    },
    "personalityTags": {
      "default": [],
      "description": "Personality traits that colour barks and haggling.",
      "type": "array",
      "items": {
        "type": "string",
        "enum": [
          "greedy",
          "gossipy",
          "suspicious",
          "generous",
          "gruff",
          "friendly",
          "shrewd",
          "nervous"
        ]
      }
    },
    "specialties": {
      "default": [],
      "description": "Item categories bought at a better rate (`specialtyBonus`); must be bought categories.",
      "type": "array",
      "items": {
        "type": "string",
        "enum": [
          "weapon",
          "armor",
          "shield",
          "ammo",
          "book",
          "key",
          "consumable",
          "tool",
          "quest",
          "artifact",
          "currency",
          "misc"
        ]
      }
    },
    "buysCategories": {
      "minItems": 1,
      "type": "array",
      "items": {
        "type": "string",
        "enum": [
          "weapon",
          "armor",
          "shield",
          "ammo",
          "book",
          "key",
          "consumable",
          "tool",
          "quest",
          "artifact",
          "currency",
          "misc"
        ]
      },
      "description": "Item categories the merchant buys from the player."
    },
    "stock": {
      "description": "What the merchant sells.",
      "type": "array",
      "items": {
        "type": "object",
        "properties": {
          "item": {
            "description": "An item the merchant stocks.",
            "type": "string",
            "pattern": "^[a-z0-9]+(?:-[a-z0-9]+)*$",
            "x-contentRef": "item"
          },
          "lootTable": {
            "description": "A loot table rolled to stock the shelf (a shop that varies).",
            "type": "string",
            "pattern": "^[a-z0-9]+(?:-[a-z0-9]+)*$",
            "x-contentRef": "loot-table"
          },
          "count": {
            "type": "integer",
            "minimum": 1,
            "maximum": 999,
            "description": "Units of the item, or rolls of the loot table."
          },
          "restock": {
            "description": "How the stock refills; absent = never restocks.",
            "type": "object",
            "properties": {
              "everyHours": {
                "type": "integer",
                "minimum": 1,
                "maximum": 720,
                "description": "In-world hours between restocks."
              },
              "amount": {
                "type": "integer",
                "minimum": 1,
                "maximum": 999,
                "description": "Units (or rolls) added each time, up to `count`."
              }
            },
            "required": [
              "everyHours",
              "amount"
            ],
            "additionalProperties": false
          }
        },
        "required": [
          "count"
        ],
        "additionalProperties": false
      }
    },
    "services": {
      "default": [],
      "description": "Services on the shop window’s Services tab (an inn’s rooms).",
      "type": "array",
      "items": {
        "type": "object",
        "properties": {
          "id": {
            "type": "string",
            "pattern": "^[a-z0-9]+(?:-[a-z0-9]+)*$",
            "description": "Service id, unique within the merchant, e.g. \"room-for-the-night\"."
          },
          "name": {
            "type": "string",
            "minLength": 1,
            "description": "What the shop window lists, e.g. \"Room for the night\"."
          },
          "price": {
            "type": "integer",
            "minimum": 1,
            "maximum": 100000,
            "description": "Crowns, fixed by the merchant: no markup, disposition or haggle applies. A `rest` service sits in the inn-bed band 8-15."
          },
          "kind": {
            "type": "string",
            "enum": [
              "rest"
            ],
            "description": "`rest`: sleep until morning, fully healed (the Sleeping Ox room)."
          }
        },
        "required": [
          "id",
          "name",
          "price",
          "kind"
        ],
        "additionalProperties": false
      }
    },
    "goldReserve": {
      "type": "integer",
      "minimum": 0,
      "maximum": 9007199254740991,
      "description": "Gold the merchant starts with to pay the player for sales."
    },
    "goldRestockPerDay": {
      "default": 0,
      "description": "Gold the reserve refills by each in-world day, up to `goldReserve`.",
      "type": "integer",
      "minimum": 0,
      "maximum": 9007199254740991
    },
    "markup": {
      "type": "number",
      "exclusiveMinimum": 0,
      "description": "Multiplier on item value when the player buys (economy band 1.1-1.5)."
    },
    "buyRate": {
      "type": "number",
      "exclusiveMinimum": 0,
      "description": "Fraction of item value paid when the player sells (band 0.3-0.6)."
    },
    "specialtyBonus": {
      "description": "Extra multiplier on the buy rate for specialties (band 1.1-1.3); default 1.2.",
      "type": "number",
      "exclusiveMinimum": 0
    },
    "isFence": {
      "default": false,
      "description": "A fence deals in stolen goods.",
      "type": "boolean"
    },
    "buysStolen": {
      "default": false,
      "description": "Buys stolen goods; only a fence (`isFence`) may.",
      "type": "boolean"
    },
    "stolenFactor": {
      "description": "Multiplier on the price of stolen goods (band 0.5-0.8); default 0.6.",
      "type": "number",
      "exclusiveMinimum": 0
    },
    "hours": {
      "description": "Opening hours (world-time hook); absent = always open.",
      "type": "object",
      "properties": {
        "open": {
          "type": "integer",
          "minimum": 0,
          "maximum": 23,
          "description": "Hour of day (0-23) the shop opens."
        },
        "close": {
          "type": "integer",
          "minimum": 0,
          "maximum": 23,
          "description": "Hour of day (0-23) it closes; may be earlier than open (overnight)."
        }
      },
      "required": [
        "open",
        "close"
      ],
      "additionalProperties": false
    },
    "barkSet": {
      "description": "Bark set id for the shopkeeper’s lines (E22).",
      "type": "string",
      "pattern": "^[a-z0-9]+(?:-[a-z0-9]+)*$"
    }
  },
  "required": [
    "id",
    "notes",
    "npcId",
    "buysCategories",
    "goldReserve",
    "markup",
    "buyRate"
  ],
  "additionalProperties": false
}
